titulo,fecha,descripcion,departamento,tipo,inmueble
Venta Departamentos Planta Baja,Publicado: 24 Marzo 2024,"VENTA Departamentos Planta Baja, 1 dormitorio, living-comedor, cocina, patio amplio, $us 40.000 - 1 dormitorio, 7mo piso, $us 38.000 - 2 dormitorios, living comedor, cocina, baño, patio servicio $us 49.500 - 3 dormitorios, living comedor, cocina, 2 baños, patio servicio, $us 68.500 - cerca IC Norte...",Cochabamba, Venta, Departamento
Cala Cala Estadium Departamento,Publicado: 24 Marzo 2024,"CALA CALA - ESTADIUM departamento en venta, de 3 dormitorios, con garaje, todo en orden, $us 90.000 o en Bolivianos. Telf. 71480778, 71760808.",Cochabamba, Venta, Departamento
Calle Tarija Propietario Vende,Publicado: 24 Marzo 2024,"CALLE TARIJA propietario vende departamento, 2 dormitorios, garaje, whatsapp. 71237707.",Cochabamba, Venta, Departamento
60 000 $us Ocasión,Publicado: 24 Marzo 2024,"60.000 $US ocasión, Libertador norte, bonito, departamento, soleado, buena vista, 2 dormitorios, con garaje. 70361700.",Cochabamba, Venta, Departamento
Departamento 3 Dormitorios 2,Publicado: 24 Marzo 2024,"DEPARTAMENTO 3 dormitorios, 2 baños, garaje, baulera, zona mercado 10 de febrero, 80.000 $us. 75967908.",Cochabamba, Venta, Departamento
Vendo Departamento 2 Dormitorios,Publicado: 24 Marzo 2024,"VENDO departamento, 2 dormitorios, 81 m2, parqueo y baulera, zona Muyurina. Ref. 79759464.",Cochabamba, Venta, Departamento
Excelente Ubicacion Departamento Duplex,Publicado: 24 Marzo 2024,EXCELENTE UBICACION Departamento duplex 4 dormitorios dependencias 2 parqueos próximo plazuela Quintanilla 75913011.,Cochabamba, Venta, Departamento
Departamento En Venta 2,Publicado: 24 Marzo 2024,"DEPARTAMENTO en venta, 2 habitaciones, con parqueo, América, Santa Cruz, 85.000 $us, ofertable. Cel. 71461552.",Cochabamba, Venta, Departamento
Departamento En Venta 3,Publicado: 24 Marzo 2024,"DEPARTAMENTO en venta, 3 habitaciones, Av. América, Sombrero de Chola, 100.000 $us, ofertable. Cel. 71461552.",Cochabamba, Venta, Departamento
Vendo Departamento Edificio Familiar,Publicado: 24 Marzo 2024,"VENDO departamento, edificio familiar, una suite, 2 dormitorios, garaje 2 autos y baulera, América oeste. Ref. 4065929, 75489666.",Cochabamba, Venta, Departamento
Vendo Departamento A Estrenar,Publicado: 24 Marzo 2024,"VENDO departamento a estrenar, en edificio Krattos, Av. Beijing y Tadeo Haenke, consta de una suite, 2 dormitorios, parqueo y baulera, $us 72.000. Ref. 67400724.",Cochabamba, Venta, Departamento
Departamento En Venta Sobre,Publicado: 24 Marzo 2024,"DEPARTAMENTO en venta, sobre el parque Lincoln, 3 Dor. 3 baños, cocina abierta, sala pequeña, despensa, área de lavandería + garaje y baulera, 83.000 $us. Ref. 64850901, 63939915 (propietarios).",Cochabamba, Venta, Departamento
Dueño Por Motivo Viaje,Publicado: 24 Marzo 2024,DUEñO Por motivo viaje vende Departamento U. Católica 63991849,Cochabamba, Venta, Departamento
Departamento En Venta 2,Publicado: 24 Marzo 2024,"DEPARTAMENTO en venta, 2 dormitorios, 2 baños, sala, cocineta, 46.000 $us. 75312922, 69411333, avenida Salamanca.",Cochabamba, Venta, Departamento
Sombrero De Chola Hermoso,Publicado: 24 Marzo 2024,"SOMBRERO DE CHOLA Hermoso departamento, 1 suite. 2 dormitorios, garaje, excelente vista, Con financiamiento. 62624601",Cochabamba, Venta, Departamento
60 000 $us Oferta,Publicado: 24 Marzo 2024,"60.000 $US  Oferta templo Cala Cala 2 dormitorios. soleado, vista norte oeste, garaje, financiamiento. 62624601",Cochabamba, Venta, Departamento
America Oeste Venta Facilidades,Publicado: 24 Marzo 2024,"AMERICA OESTE Venta facilidades de pago departamento 2 dormitorios comodidades, primer piso. Recibo movilidad o lote parte de pago. Sra Elena 70385109",Cochabamba, Venta, Departamento
Preventa Monoambientes Desde 15500,Publicado: 24 Marzo 2024,"PREVENTA MONOAMBIENTES DESDE 15500 $us, Departamentos 1, 2 y 3 dormitorios, edificio con piscina, sauna, gimnasio. Ubicación residencial Av. América y Gabriel Rene Moreno. Abstenerse inmobiliarias. 63903611",Cochabamba, Venta, Departamento
Parque Fidel Anze $us125000,Publicado: 24 Marzo 2024,"PARQUE FIDEL ANZE $US125000 Vendo Espectacular Departamento de Lujo de 154 Mts2, 3 Dormtorios, Living Comedor, Balcones, Dependencias, Garaje, Piscina, Areas Sociales whatsapp 70313588 vendohogar",Cochabamba, Venta, Departamento
America Este Oferta $us99000,Publicado: 24 Marzo 2024,"AMERICA ESTE OFERTA $US99000 Vendo Departamento de Lujo 3 Dormitorios Piscina Areas Sociales, informaciones 70713189",Cochabamba, Venta, Departamento
Avenida Salamanca A Estrenar,Publicado: 24 Marzo 2024,"AVENIDA SALAMANCA A ESTRENAR Vendo Departamento 3 Dormitorios, 145 mts, Hermosa Vista Piso 10, Piscina , Areas Sociales, Dolares 119000, 70313588 vendohogar",Cochabamba, Venta, Departamento
Vendo O Permuto Precioso,Publicado: 24 Marzo 2024,"Vendo o permuto precioso departamento con o sin muebles. (3 suites, terraza, 5 baños, cuartos de servicio y lavado, parqueo, áreas comunes con piscina atemperada y otros. Zona Norte (Av. Santa Cruz y Ciclovía) En caso de permuta acepto departamento o casita nuevos o para remodelar. Telf: 70714747 ó...",Cochabamba, Venta, Departamento
Lote En Venta Zona,Publicado: 24 Marzo 2024,"LOTE en venta, zona Chacacollo, sobre Av. Kakerama, 340 m2, a unos pasos al sud, de la Av. Chapare. Telf. 70741358.",Cochabamba, Venta, Lote / Terreno
10 500 Lotes A,Publicado: 24 Marzo 2024,"10.500 LOTES A crèdito en Tarata, cuotas de acuerdo a su bolsillo. Tel. 77411957, 60736288",Cochabamba, Venta, Lote / Terreno
Km 6 Blanco Galindo,Publicado: 24 Marzo 2024,KM 6 BLANCO GALINDO  A media cuadra de la Avenida hermoso lote 4.000 m2 frente 45 m2 ideal para condominio urbanización de casas 263 $us por m2 Todo proyecto 72275744,Cochabamba, Venta, Lote / Terreno
Av Teofilo Vargas Cala,Publicado: 24 Marzo 2024,AV TEOFILO VARGAS  Cala Cala hermoso lote 375 m2 todo proyecto 375.000 $us 72275744,Cochabamba, Venta, Lote / Terreno
Sarco Hermoso Lote 551,Publicado: 24 Marzo 2024,"SARCO Hermoso lote 551 m2 cerca Tadeo Haenke Beijing. Ideal todo proyecto 255.000 $us. Otro lote 491  m2 Sarco pasos América Ideal Edificio 375.000 $us, 72275744",Cochabamba, Venta, Lote / Terreno
Av Victor Ustariz Lote,Publicado: 24 Marzo 2024,AV VICTOR USTARIZ  Lote 1.700 m2 Av Víctor Ustariz pasos Melchor Pérez 790 $us. por m2 Todo proyecto. 72275744,Cochabamba, Venta, Lote / Terreno
Av Blanco Galindo Km,Publicado: 24 Marzo 2024,AV BLANCO GALINDO KM 1.5  Lote 852 m2 frente 17m ideal industria edificio 920.000 $us. 7227574,Cochabamba, Venta, Lote / Terreno
Vendo Lote 346 08,Publicado: 24 Marzo 2024,"VENDO lote, 346.08 m2, zona Rumy Mayu (Tiquipaya), a mts. Av. Franz Tamayo, altura Km 5, B. Galindo. Cel. 72210920, 67535140.",Cochabamba, Venta, Lote / Terreno
270 $us M2 Capitán,Publicado: 24 Marzo 2024,"270 $US M2 Capitán Ustariz, lote 4.500 m2, para condominios, camiones, industrias, luz trifásico, vivienda. 70361700.",Cochabamba, Venta, Lote / Terreno
47 000 $us Lote,Publicado: 24 Marzo 2024,"47.000 $US lote venta, 319 m2, Tiquipaya, Encantopampa. 75967908.",Cochabamba, Venta, Lote / Terreno
Lote En Venta 25,Publicado: 24 Marzo 2024,"LOTE en venta, 25.000 $us, Sacaba, Km 7 1/2, Circunvalación, papeles al día, servicios básicos. Cel. 68446900.",Cochabamba, Venta, Lote / Terreno
De Ocasion Lote 639,Publicado: 24 Marzo 2024,DE OCASION Lote 639 m2 Tiquipaya sobre avenida frente al mercado campesino amurallado 75913011.,Cochabamba, Venta, Lote / Terreno
Lote De 600 M2,Publicado: 24 Marzo 2024,"LOTE de 600 m2, en venta, 8x75 m2, 1 cuadra al sud de la Av. Villazón, a la altura de la Botella Pepsi, 70.000 $us. Cel. 71461552.",Cochabamba, Venta, Lote / Terreno
Terreno En Venta Sobre,Publicado: 24 Marzo 2024,TERRENO En venta sobre la final Ayacucho sur de 271 mts2. c/papeles al dìa. Llamar al 75488562 sòlo interesados sin intermediarios.,Cochabamba, Venta, Lote / Terreno
Vendo Lote De 308,Publicado: 24 Marzo 2024,"VENDO Lote de 308 m2., ubicado a 100 metros al este del Hospital Cuschieri (Colcapirhua), documentación al día, 68.000 dólares, Cel. 72219937",Cochabamba, Venta, Lote / Terreno
Inmobiliaria Santiago Apostol Le,Publicado: 24 Marzo 2024,"INMOBILIARIA SANTIAGO APOSTOL Le ofrece lotes: Sacaba, z. Huayllani, 250 m2. Vinto, z. San Jorge, 6.683 m2. Quillacollo, z. Pandoja, 341 m2. Zona El Paso, 243 m2. 713 m2. Cel. 67484086",Cochabamba, Venta, Lote / Terreno
Oportunidad Excelente Terreno En,Publicado: 24 Marzo 2024,"OPORTUNIDAD excelente terreno, en paso a 3 cuadras hacia el norte de la plaza principal, próximamente, Av. Principal, 3.000 m2, 30 frente y 100 fondo. Ref. whatsapp. 75981592 o 70756106.",Cochabamba, Venta, Lote / Terreno
Vendo Lote 300 M2,Publicado: 24 Marzo 2024,"VENDO lote, 300 m2, Urb. Fabril - Huayllani. Cel. 76456826.",Cochabamba, Venta, Lote / Terreno
Lote Amurallado De 553,Publicado: 24 Marzo 2024,"LOTE amurallado, de 553 m2, en 85.000 dólares, conversable, ubicado en urbanización AIG, lado norte de ""Ciudad del Niño"", toda documentación en orden. Ref. 70343521, Cel. y whatsapp.",Cochabamba, Venta, Lote / Terreno
Sipe Sipe Bonito Lote,Publicado: 24 Marzo 2024,"SIPE SIPE bonito lote en venta, dentro de urbanización 262 m2, todos los servicios. Ref. 71717359.",Cochabamba, Venta, Lote / Terreno
Vendo Lote De 423,Publicado: 24 Marzo 2024,"VENDO lote de 423 m2, con todos los servicios, en la d'Orbigny. Ref. 79733997, 71795555.",Cochabamba, Venta, Lote / Terreno
Venta Lote Chimba Cochabamba,Publicado: 24 Marzo 2024,"VENTA lote, Chimba, Cochabamba, 831 m2, 30 m2 de frente instalados, agua, alcantarillado, Dir. C.R. Arce, Rosseti, documentos al día. Cel. 31515788.",Cochabamba, Venta, Lote / Terreno
Terreno En Venta En,Publicado: 24 Marzo 2024,"TERRENO en venta, en Tiquipaya, 1615 m2, a 80 $us/m2, luz, agua potable, charlable. 62724479.",Cochabamba, Venta, Lote / Terreno
Bonito Y Amplio Lote,Publicado: 24 Marzo 2024,"BONITO  Y amplio lote en venta. Ciudad de Cochabamba. Zona Villa Montenegro. Carretera a Oruro, doble vía Kilómetro 24. Superficie de 1.900 metros cuadrados. Frente de 25 metros. Salida hacía la carretera antigua. Ambientes: 2 tiendas sobre la carretera asfaltada. 3 baños. Sala de 100 metros...",Cochabamba, Venta, Lote / Terreno
Chiquicollo Avenida Linde Lote,Publicado: 24 Marzo 2024,"CHIQUICOLLO Avenida Linde lote 315 m2 todos los servicios 72270213, 4256276.",Cochabamba, Venta, Lote / Terreno
Colcapirhua Pasos Avenida Reducto,Publicado: 24 Marzo 2024,"COLCAPIRHUA Pasos avenida Reducto, 2 lotes 260 y 200 m2. 72270213, 4256276.",Cochabamba, Venta, Lote / Terreno
En Venta Lote 38,Publicado: 24 Marzo 2024,"EN VENTA Lote 38.000 dólares, papeles al día 295 m2 fabril Huayllani plena esquina 4223861 WhatsApp 77961114.",Cochabamba, Venta, Lote / Terreno
Vendo Lote De 1,Publicado: 24 Marzo 2024,"VENDO Lote de 1.300 m2 en zona “4 esquinas” $130/ m2 enmallado Olímpico (todo el perímetro), papeles en orden. Telf 72222933",Cochabamba, Venta, Lote / Terreno
900 Mts Vendo Lote,Publicado: 24 Marzo 2024,"900 MTS vendo lote en Maica. 76450426, 74325086.",Cochabamba, Venta, Lote / Terreno
210 000 Bs Vendo,Publicado: 24 Marzo 2024,"210.000 BS.  vendo lote de 300 mts, en Maica. 76450426, 74326086.",Cochabamba, Venta, Lote / Terreno
Lote 350 M2 Avenida,Publicado: 24 Marzo 2024,"LOTE 350 m2, avenida Túnel El Abra, zona Callaj Chullpa, $us 12.000, con minuta, referencias: 72770033, 77421200.",Cochabamba, Venta, Lote / Terreno
Lote 203 M2 Amurallado,Publicado: 24 Marzo 2024,"LOTE 203 m2, amurallado, media cuadra, avenida Panamericana, calle Santa Bárbara, $us 48.000. Ref. 77421200, 72770033.",Cochabamba, Venta, Lote / Terreno
Real Ocasion Lindo Lote,Publicado: 24 Marzo 2024,"REAL OCASION lindo lote, 301 m2, 2 cuadras de la avenida Túnel El Abra, urbanización Esmeralda sud, $us 19.500. Ref. 77421200.",Cochabamba, Venta, Lote / Terreno
Lote Tiquipaya Sirpita Zona,Publicado: 24 Marzo 2024,"LOTE Tiquipaya, Sirpita, zona segura, servicios en zona, 423 m2. Ref. 71735714.",Cochabamba, Venta, Lote / Terreno
Blanco Galindo Vendo 2,Publicado: 24 Marzo 2024,"BLANCO GALINDO vendo 2 lotes de 316 y 325 m2, a una cuadra de la Av. Blanco Galindo, Km 4 1/2, en la calle Cesar Adriazola, frente al parque. Ref. 4400146, 71767381.",Cochabamba, Venta, Lote / Terreno
Lote Amurallado 270 M2,Publicado: 24 Marzo 2024,"LOTE Amurallado 270 m2, listo para construir su casa, zona túnel del Abra, tiene todos los servicios, papeles completos e impuestos al día, Ref. 69465807",Cochabamba, Venta, Lote / Terreno
Remato Lotes Vinto A,Publicado: 24 Marzo 2024,"REMATO lotes, Vinto, a 60 m2, de 180 a 200 m2, 2 cuadras de avenida. Cel. 78318089.",Cochabamba, Venta, Lote / Terreno
DueÑa Vende Lote En,Publicado: 24 Marzo 2024,"DUEÑA Vende lote en excelente ubicación América y Manchaypuito. Sin intermediarios. Ref. 77911927, 77409101, 4242973",Cochabamba, Venta, Lote / Terreno
Vendo Lote 3500 M2,Publicado: 24 Marzo 2024,"VENDO Lote 3500 m2, Llawkenquiri camino al paso amurallado con luz y agua. 70744006, 4420900",Cochabamba, Venta, Lote / Terreno
Dueño Vende Lote De,Publicado: 24 Marzo 2024,"DUEñO Vende lote de 703 m2 divisible Tacopoca, Sacaba $us 43.000 Tel. 71763683.",Cochabamba, Venta, Lote / Terreno
Dueño Vende Lote De,Publicado: 24 Marzo 2024,"DUEñO Vende lote de 415 m2., Huayllani Sud, Sacaba, $us. 32.000. Tel. 71763683.",Cochabamba, Venta, Lote / Terreno
Lotes En Venta De,Publicado: 24 Marzo 2024,"LOTES En venta de 250, 300 m2., Linde Bajo Sacaba, Tel. 71763683.",Cochabamba, Venta, Lote / Terreno
Universidad Catolica Oferta Inmediaciones,Publicado: 24 Marzo 2024,"UNIVERSIDAD CATOLICA  Oferta Inmediaciones, bonitos lotes 830 m2, 420 m2 Precio 500 $us m2. 62624601",Cochabamba, Venta, Lote / Terreno
Blanco Galindo Km 6,Publicado: 24 Marzo 2024,"BLANCO GALINDO KM_ 6 Zona Santa Rosa, En Venta Terreno 3660 m2 con Galpon entre Avenidas Blanco Galindo y Victor Ustariz, informaciones 70313588 abstenerse inmobiliarias",Cochabamba, Venta, Lote / Terreno
Venta O Anticr Tico,Publicado: 24 Marzo 2024,"VENTA O anticrètico cèntrica oficina, 3 ambientes. Tel. 77411957, 60736888",Cochabamba, Venta, Oficina
Vendo $us 205 000,Publicado: 24 Marzo 2024,"VENDO $us. 205.000 local comercial 248 m2, baños, oficinas parqueo sobre Av. América oeste. 70370396",Cochabamba, Venta, Local Comercial
Venta Hermoso Local Comercial,Publicado: 24 Marzo 2024,"VENTA Hermoso local comercial a 2 cuadras Plaza Cala Cala 200 m2, papeles al día, sobre Man Cesped. Ref. 61594350",Cochabamba, Venta, Local Comercial
En Venta Lote Fúnebre,Publicado: 24 Marzo 2024,"EN VENTA lote fúnebre ""Parque La Concordia"", sector ""Los Ceibos"", precio 4.100 $us. Cel. 70758982.",Cochabamba, Venta, Varios
Vendo Espacio Cementerio Concordia,Publicado: 24 Marzo 2024,"VENDO Espacio, Cementerio Concordia Sección Robles Telf. 4441910, 72735385.",Cochabamba, Venta, Varios
De Ocasion Y Por,Publicado: 24 Marzo 2024,DE OCASION Y por motivo de salud en venta nicho en la Concordia sector Olivos Cel. 64484476,Cochabamba, Venta, Varios
Edificio Comercial Av Ayacucho,Publicado: 24 Marzo 2024,EDIFICIO COMERCIAL Av. Ayacucho super rentable 6 pisos 10 locales comerciales 5 departamentos. Infórmese otro edificio Calama 5 pisos 5 departamentos tienda 375.000 $us 72275744,Cochabamba, Venta, Edificios
Fabrica Equipada Km 6,Publicado: 24 Marzo 2024,FABRICA EQUIPADA Km 6 Av. Blanco Galindo 5.000 m2 frente 35 m galpones oficinas maquinaria equipos completos. Infórmese 72275744,Cochabamba, Venta, Industria y comercio
Casa En Alquiler Pacata,Publicado: 24 Marzo 2024,"CASA en alquiler, Pacata Alta, calle 5, tras colegio Calvert. Telf. 4483097, 7719057.(*)",Cochabamba, Alquiler, Casa / Chalet
Condominio La Serena Tiquipaya,Publicado: 24 Marzo 2024,"CONDOMINIO LA SERENA Tiquipaya, hermosa casa, amplio jardín, 3 dormitorios, dependencias, $us 750, incluye expensas. 77702006, 76201242.",Cochabamba, Alquiler, Casa / Chalet
Casas En Condominio Cómodas,Publicado: 24 Marzo 2024,"CASAS en condominio, cómodas, frente colegio Tiquipaya, cuatro dormitorios, ($us 800), 3 dormitorios ($us 600), dependencias completas. 76201242, 77702006.",Cochabamba, Alquiler, Casa / Chalet
Alquilo Amplia Casa Con,Publicado: 24 Marzo 2024,"ALQUILO amplia casa, con garaje y parrillero. Ref. 70764364, 62618540, Ubic. Inst. Americano.",Cochabamba, Alquiler, Casa / Chalet
Alquilo Casa Independiente 3,Publicado: 24 Marzo 2024,"ALQUILO Casa independiente, 3 dormitorios, dependencias, gas, amplio garaje, techado, jardìn amplio, 2.300 Bs. Av. Ecològica, Aldeas SOS. 72796276, 79344274",Cochabamba, Alquiler, Casa / Chalet
Bonita Casita Alquiler Venta,Publicado: 24 Marzo 2024,"BONITA Casita alquiler-venta cocina comedor dormitorio amplio baño y living patio de 500 m2 Urb. Ecologica Tiquipaya 71722557, 71726100",Cochabamba, Alquiler, Casa / Chalet
Alquiler Casa Independiente Con,Publicado: 24 Marzo 2024,"ALQUILER Casa independiente con un departamento de dos dormitorios, uno con ropero, living, comedor, cocina (cajonerìa alta y baja), gas domiciliario, baño, garaje y jardìn. No mascotas, no whatsapp , directo con el dueño Villa Granado 79974409",Cochabamba, Alquiler, Casa / Chalet
Atencion Empresas Se Alquila,Publicado: 24 Marzo 2024,"ATENCION EMPRESAS se alquila casa amplia, con varios ambientes, para oficinas, con garaje, para 4 mibilidades, zona norte, c/Felix del Granado, entre Teófilo Vargas y Obispo Anaya Nro 30. 71700569, 4414044.",Cochabamba, Alquiler, Casa / Chalet
Casa Cerca Prado 3,Publicado: 24 Marzo 2024,"CASA cerca Prado, 3 dormitorios auxiliar, otro departamento 3 dormitorios, para oficina Epoca. 70361700.",Cochabamba, Alquiler, Casa / Chalet
Bs 2 000 Próximo,Publicado: 24 Marzo 2024,"BS. 2.000 Próximo Clínica Los Angeles - Teófilo Vargas. Departamento PB dos dormitorios, living comedor, cocina, baño, despensa, garaje. 4718915 70354998",Cochabamba, Alquiler, Departamento
Bs 1 800 Próximo,Publicado: 24 Marzo 2024,"BS. 1.800 Próximo Parque D. Canelas. Departamento tres dormitorios, living comedor, cocina baño, jardín, garaje. 4718915 70354998",Cochabamba, Alquiler, Departamento
Bs 1 600 Aniceto,Publicado: 24 Marzo 2024,"BS. 1.600 Aniceto Padilla Zona Stadio. Departamento dos dormitorios, living comedor, cocina, bario, gas domiciliario. Preferencia señoritas estudiantes. 4718915 70354998",Cochabamba, Alquiler, Departamento
Bs 2 500 Ayacucho,Publicado: 24 Marzo 2024,"BS. 2.500 Ayacucho, México. Departamento en edificio para oficinas. Tres ambientes, recepción, cocina, baño. 4718915 70354988",Cochabamba, Alquiler, Departamento
Alquilo Departamento Céntrico Sala,Publicado: 24 Marzo 2024,"ALQUILO departamento, céntrico, sala, 2 dormitorios, roperos, cocina, baño, terraza independiente, primer piso. 71750661.",Cochabamba, Alquiler, Departamento
Departamento 115 M2 En,Publicado: 24 Marzo 2024,"DEPARTAMENTO 115 m2, en edificio moderno (piscina, salón, terrazas, parrilleros), con garaje y baulera, Bs. 2.600, cerca al Cine Center. Ref. 70750950.",Cochabamba, Alquiler, Departamento
Dueño Alquila Departamento Cómodo,Publicado: 24 Marzo 2024,"DUEñO alquila departamento cómodo, elegante y funcional, en edificio familiar, 1 suite y 2 habitaciones, con todas las dependencias, cocina equipada, área de almacenamiento, ubicación, céntrica, zona Estadium, Ref. 79376763, precio 2.300 Bs.",Cochabamba, Alquiler, Departamento
Dueño Alquila En Edificio,Publicado: 24 Marzo 2024,"DUEñO alquila en edificio familiar, departamento, 2 habitaciones y demás dependencias, zona Estadium, precio 1.500 Bs. Ref. 79376763.",Cochabamba, Alquiler, Departamento
Bs 1700 2300 3300,Publicado: 24 Marzo 2024,"BS 1700,2300, 3300,  Hermosos departamentos amoblados céntricos incluye servicios opcional alquilar 1 mes 75913011.",Cochabamba, Alquiler, Departamento
Centro Alquilamos Departamento De,Publicado: 24 Marzo 2024,"CENTRO alquilamos departamento de 2 habitaciones, con roperos empotrados, living comedor, cocina, con 2 mesones de cerámica, cajonería baja y alta, 2 baños, con tina y cable e internet, luz propia (precio 1.400.00 Bs), en 1er piso, dirección: Tumusla 560 entre Calama y Ladislao Cabrera. Cel....",Cochabamba, Alquiler, Departamento
Ciudad Del Niño Departamento,Publicado: 24 Marzo 2024,"CIUDAD DEL NIñO departamento de 3 dormitorios, almacén y garaje, 1.500 Bs. sin mascotas. 70371595.",Cochabamba, Alquiler, Departamento
Detras Bosque 2 Departamento,Publicado: 24 Marzo 2024,"DETRAS BOSQUE 2  departamento, 3 dormitorios, con garaje, 1.200 Bs. sin mascotas. 70371595.",Cochabamba, Alquiler, Departamento
Alquilo Departamentos 2 Y,Publicado: 24 Marzo 2024,"ALQUILO departamentos 2 y 3 dormitorios, dependencias, avenida d'Orbigny oeste, cerca Cementerio Concordia. Telf. 72756465.",Cochabamba, Alquiler, Departamento
Se Alquila Un Departamento,Publicado: 24 Marzo 2024,"SE ALQUILA un departamento pequeño, Km 5, subiendo Av. Octava hasta colegio Huggies Schools, doblarse a la mano izquierda, 2 cuadras pequeñas. Telf. 4712244.",Cochabamba, Alquiler, Departamento
Alquilo Departamento Independiente Zona,Publicado: 24 Marzo 2024,"ALQUILO Departamento independiente, zona Colcapirhua, tres dormitorios, baño, sala, comedor 76991217, 79005580.",Cochabamba, Alquiler, Departamento
Departamento De 3 Dormitorios,Publicado: 24 Marzo 2024,"DEPARTAMENTO de 3 dormitorios, living comedor, cocina y baño en anticrético, frente al parque urbano Ollantay. Ref. 4446393, 72702593.",Cochabamba, Alquiler, Departamento
Departamento En Alquiler 3,Publicado: 24 Marzo 2024,"DEPARTAMENTO en alquiler, 3 cuartos, cocina, baño, fono: 72712333, 4428339.",Cochabamba, Alquiler, Departamento
Alquilo Departamento En Av,Publicado: 24 Marzo 2024,"ALQUILO departamento en Av. América este, consta de 2 dormitorios, living comedor, escritorio, cocina y baño, incluye parqueo, referencias al Cel. 77430026.",Cochabamba, Alquiler, Departamento
Se Alquila Mono Ambiente,Publicado: 24 Marzo 2024,"SE ALQUILA mono ambiente, amoblado, España y Ecuador. 68226521.",Cochabamba, Alquiler, Departamento
Alquilo Garzoniers Villa Pagador,Publicado: 24 Marzo 2024,"ALQUILO Garzoniers Villa Pagador. Telf. 4442067, 72735385.",Cochabamba, Alquiler, Departamento
Alquilo Departamento 2 Dormitorios,Publicado: 24 Marzo 2024,"ALQUILO departamento, 2 dormitorios, sala comedor, cocina, baño, 850 Bs. Av. Chapare, Km 4.5 Sacaba. 61628222.",Cochabamba, Alquiler, Departamento
Alquilo Departamento Auxiliar A,Publicado: 24 Marzo 2024,"ALQUILO departamento auxiliar, a 2 cuadras de la U. Católica. 70762274.",Cochabamba, Alquiler, Departamento
Acogedor Departamento Amoblado 85,Publicado: 24 Marzo 2024,"ACOGEDOR departamento amoblado, 85 m2, 2 dormitorios, dependencias, Av. Ayacucho, cerca al Prado, Bs. 2.300, incluye expensas. Ref. 70750950.",Cochabamba, Alquiler, Departamento
DueÑo Alquila Hermoso Departamento,Publicado: 24 Marzo 2024,DUEÑO Alquila hermoso departamento 2 dormitorios en suite con todas las dependencias calle Guzmán entre Villarroel y Tarija Cel. 70362092,Cochabamba, Alquiler, Departamento
Bonito Departamento En Planta,Publicado: 24 Marzo 2024,"BONITO Departamento en planta baja cocina comedor dormitorio amplio living y patio p/moto Final América Oeste Urb. Promotora Ref. 71722557, 71726100",Cochabamba, Alquiler, Departamento
Garzonier Alquiler Zona Rotonda,Publicado: 24 Marzo 2024,"GARZONIER Alquiler zona Rotonda Peru y d´Orbigny un departamento, living, comedor, cocina, patio, baño privado, sin garaje. Cel. 71444038",Cochabamba, Alquiler, Departamento
Departamento En Alquiler Cala,Publicado: 24 Marzo 2024,"DEPARTAMENTO en alquiler, Cala Cala, familiar, 103 m2, 3 habitaciones, una de ellas con baño privado, 2 baños, gas natural, llamar al 71743744.",Cochabamba, Alquiler, Departamento
DueÑo Alquila Hermoso Garzonier,Publicado: 24 Marzo 2024,"DUEÑO Alquila hermoso garzonier en excelente ubicación. Ref. 4413326, 75463025",Cochabamba, Alquiler, Departamento
Alquiler Departamento Tres Dormitorios,Publicado: 24 Marzo 2024,"ALQUILER Departamento tres dormitorios, con dependencias, edificio Puerto Vallarta calle Pedro Blanco y Trinidad. 77427944",Cochabamba, Alquiler, Departamento
1 700 Bs Cruce,Publicado: 24 Marzo 2024,1.700 BS. Cruce Taquiña mercado alquiler amplio departamento bastante iluminado 3 dormitorios 1 en suite todas con cortinas 2 baños dependencias completas lavandería garaje opcional entrega inmediata 77994624 Whatsapp,Cochabamba, Alquiler, Departamento
1 700 Bs Temporal,Publicado: 24 Marzo 2024,1.700 BS. Temporal Cala Cala alquiler departamento 2 dormitorios dependencias completas garaje opcional entrega inmediata 77994624 Whatsapp,Cochabamba, Alquiler, Departamento
Departamento En Alquiler Amoblado,Publicado: 24 Marzo 2024,"DEPARTAMENTO en alquiler, amoblado, 1 dormitorio + baño, más living, cocina, 950 Bs. , plaza Cala Cala, una cuadra al este, Juan Huallparrimachi, Edif. Rafael. Cel. 70732178.",Cochabamba, Alquiler, Departamento
Parque Fidel Anze Hermoso,Publicado: 24 Marzo 2024,"PARQUE FIDEL ANZE Hermoso departamento 1 suite, 1 dormitorio, garaje, piscina. Época bienes Raíces. 62624601",Cochabamba, Alquiler, Departamento
Templo Cala Cala Hermoso,Publicado: 24 Marzo 2024,"TEMPLO CALA CALA  Hermoso departamento amoblado, 1 suite, garaje, piscina. Época bienes Raíces. 62624601",Cochabamba, Alquiler, Departamento
Departamento 3 Dormitorios 1,Publicado: 24 Marzo 2024,"DEPARTAMENTO 3 dormitorios, 1 baño completo, living comedor, cocina, cajonería, terraza, con lavandería independiente, Av. 9 de Abril, zona las Cuadras, Bs. 1.300, referencias: 77421200.",Cochabamba, Alquiler, Departamento
Bs 2850 Cine Center,Publicado: 24 Marzo 2024,"Bs 2850 CINE CENTER Departamento Amoblado y Equipado. 3 Dormitorios, informaciones 70313588 vendohogar",Cochabamba, Alquiler, Departamento
