titulo,fecha,descripcion,departamento,tipo,inmueble
Casa En Venta Zona,Publicado: 15 Marzo 2024,"CASA en venta, zona El Abra, Av. Túnel, una cuadra antes del primer semáforo, papeles al día. Cel. 77100962.",Cochabamba, Venta, Casa / Chalet
Remato Casa En Avenida,Publicado: 15 Marzo 2024,"REMATO casa en avenida del Túnel Km 1, primer semáforo. 67525274.",Cochabamba, Venta, Casa / Chalet
Casa En Venta Dos,Publicado: 15 Marzo 2024,"CASA  En venta dos departamentos independientes, en plena esquina doble vía, frente a cancha polifuncional área residencial, papeles al día trato directo con el dueño 79938329",Cochabamba, Venta, Casa / Chalet
Dueño Vende Lote En,Publicado: 15 Marzo 2024,"DUEñO vende lote en Quillacollo, 200 - 300 - 600 m2. Fono: 67519571.",Cochabamba, Venta, Lote / Terreno
En Venta Lote De,Publicado: 15 Marzo 2024,"EN VENTA Lote de terreno zona norte Capacachi. Whatsapp 64146794, 76457404",Cochabamba, Venta, Lote / Terreno
Garzonier En Alquiler Para,Publicado: 15 Marzo 2024,"GARZONIER en alquiler, para señora sola, zona norte. 60366120.",Cochabamba, Alquiler, Departamento
1 700 Bs Cruce,Publicado: 15 Marzo 2024,1.700 BS. Cruce Taquiña alquiler departamento 3 dormitorios con cortinas 2 baños dependencias completas lavandería garaje opcional entrega inmediata 77994624 whatsapp,Cochabamba, Alquiler, Departamento
En Alquiler Consultorio Dental,Publicado: 15 Marzo 2024,"EN ALQUILER consultorio dental, equipado, Pacata Baja. Cel. 79735978.",Cochabamba, Alquiler, Oficina
Economico Alquilo Tienda Lanza,Publicado: 15 Marzo 2024,"ECONOMICO alquilo tienda, Lanza 350, entre Ecuador y Venezuela, una cuadra a plaza Colón. Cel. 71406578.",Cochabamba, Alquiler, Local Comercial
Alquilo Habitaciones Para Estudiantes,Publicado: 15 Marzo 2024,"ALQUILO habitaciones, para estudiantes o persona sola, zona UMSS, Hospital Viedma, facultad Medicina, Bioquímica. 79368609.",Cochabamba, Alquiler, Habitación
12 000 $us Cruce,Publicado: 15 Marzo 2024,12.000 $US. Cruce Taquiña anticrético casita totalmente independiente 1 dormitorio amplio dependencias patiecito garaje moto Libre de gravámenes 77994624 Whatsapp,Cochabamba, Anticrético, Casa / Chalet
12 000 $us Anticrético,Publicado: 15 Marzo 2024,"12.000 $US anticrético, casita independiente, Cruce Taquiña, 1 dormitorio, dependencias, gas, lavandería, garaje moto. 77994624",Cochabamba, Anticrético, Casa / Chalet
Anticretico Zona Las Cuadras,Publicado: 15 Marzo 2024,"ANTICRETICO (Zona: Las Cuadras) departamento de 2 dormitorios. Nicaragua S-777 Telf. 4257662, Cel. 64895372.",Cochabamba, Anticrético, Departamento
2 Cuartos En Anticrético,Publicado: 15 Marzo 2024,"2 CUARTOS en anticrético, ubicado en calle final Sucre, Cel. whatsapp. 79378756, 79974762, precio 5.100 $us, (los dos).",Cochabamba, Anticrético, Habitación
Necesito Un Departamento O,Publicado: 15 Marzo 2024,"NECESITO un departamento o garzonier en zona central, con uno o dos dormitorios. Telf. 70862855.",Cochabamba, Anticrético, Demanda
Se Vende Departamento De,Publicado: 15 Marzo 2024,"SE VENDE departamento de 2 dormitorios, 1 baño, zona Av. América oeste, de 73 mts, sin parqueo. Ref. 76353933.",Cochabamba, Venta, Departamento
Departamento En Anticrético Primer,Publicado: 15 Marzo 2024,"DEPARTAMENTO en anticrético, primer piso, barrio Marevi (Chimba). 73034552.",Cochabamba, Anticrético, Departamento
Anticretico 1 Habitación Más,Publicado: 15 Marzo 2024,"ANTICRETICO 1 habitación, más baño y ducha independiente, 5.000 $us, zona Base Aérea. 70798503.",Cochabamba, Anticrético, Habitación
Casa En Venta Barrio,Publicado: 15 Marzo 2024,"CASA en venta, barrio Adela Zamudio, IMBA, parada micro K. 73034552.",Cochabamba, Venta, Casa / Chalet
Venta Hermosa Casa Inmediaciones,Publicado: 15 Marzo 2024,"VENTA hermosa casa, inmediaciones Cine Center, 530 m2, lote 380 m2 construcción, Cel./WP 75900145, 77457710.",Cochabamba, Venta, Casa / Chalet
Departamento Condominio Ubuntu A,Publicado: 15 Marzo 2024,"DEPARTAMENTO Condominio Ubuntu, a 3 cuadras de la Plaza de Cala Cala Torre de 25 pisos de entrega inmediata Supervisión de Obra: Ing. Pablo Soto Quiroga Cel. 71460400 últimos departamentos.",Cochabamba, Venta, Departamento
Departamentos Condominio Oomoto En,Publicado: 15 Marzo 2024,"DEPARTAMENTOS Condominio OOMOTO. En Tiquipaya próximo al Colegio Tiquipaya. Más de 1 Hectárea de áreas comunes: 3 piscinas atemperadas, cabañas de churrasqueros, gimnasio y campos deportivos. Supervisión de Obra: Ing. Pablo Soto Quiroga. Cel. 71460400.",Cochabamba, Venta, Departamento
Doy Departamentos En Anticrético,Publicado: 15 Marzo 2024,"DOY DEPARTAMENTOS En anticrético en Quillacollo cerca del Cine Center. Llamar 65330552, 70306558",Cochabamba, Anticrético, Departamento
Departamentos Condominio Villa Fratterna,Publicado: 15 Marzo 2024,DEPARTAMENTOS Condominio VILLA FRATTERNA. Es como vivir en un Hotel de ***** Vive en comunidad. Supervisión de Obra: Ing. Pablo Soto Quiroga Cel: 71460400.,Cochabamba, Venta, Departamento
Vendo Lote 520 M2,Publicado: 15 Marzo 2024,"VENDO lote, 520 m2, Pucara Grande, c/luz. 78336217.",Cochabamba, Venta, Lote / Terreno
Venta Oficinas Torres Del,Publicado: 15 Marzo 2024,"VENTA oficinas, Torres del Prado, con 2 parqueos, 4 bauleras, 150 m2, Cel./WP. 75900145, 77457710.",Cochabamba, Venta, Oficina
Venta Local Comercial Salida,Publicado: 15 Marzo 2024,"VENTA local comercial, salida a calle, c/garaje, baño, cocineta, inmediaciones Stadium, WP. 75900145, 77457710.",Cochabamba, Venta, Local Comercial
Departamento En Alquiler En,Publicado: 15 Marzo 2024,DEPARTAMENTO En alquiler en la zona sur Cel. 73793402.,Cochabamba, Alquiler, Departamento
Venta Medias Aguas Z,Publicado: 15 Marzo 2024,"VENTA  Medias aguas, Z. Norte de 600,98 m2 sobre Casto Rojas entre Atacama y Tocopilla, a 1 cuadra de la Melchor Pérez de Holguín Cel: 72638205",Cochabamba, Venta, Lote / Terreno
Thunupa Villavicencio Casa Amplia,Publicado: 14 Marzo 2024,"THUNUPA, VILLAVICENCIO Casa amplia, 3 dormitorios, dependencias, patio, jardín, garaje amplio, $us. 185.000, 79788738",Cochabamba, Venta, Casa / Chalet
Melchor Perez Simon Lopez,Publicado: 14 Marzo 2024,"MELCHOR PEREZ, SIMON LOPEZ Casa, 2 plantas, 3 dormitorios, dependencias, tienda, patio, garaje, $us. 118.000, 79788738",Cochabamba, Venta, Casa / Chalet
Tadeo Haenke Beijing Casa,Publicado: 14 Marzo 2024,"TADEO HAENKE, BEIJING Casa, 2 plantas, 3 dormitorios, dependencias, patio, jardín, garaje, $us. 165.000. Ofertable, 79788738",Cochabamba, Venta, Casa / Chalet
Final America Oeste Bonita,Publicado: 14 Marzo 2024,"FINAL AMERICA OESTE Bonita casa, 3 niveles, master suite, suite, 3 dormitorios, escritorio, dependencias, dependencias de servicio, patio, jardín, parrillero, garaje, 79788738",Cochabamba, Venta, Casa / Chalet
Villa Moscu Bonita Casa,Publicado: 14 Marzo 2024,"VILLA MOSCU Bonita casa, 2 plantas, 2 suites, 3 dormitorios, escritorio, dependencias, bar, sauna, dependencias de servicio, horno, semi sótano, patio, jardín, parrillero, garaje, $us 180.000, Ofertable, 79788738",Cochabamba, Venta, Casa / Chalet
U M S S,Publicado: 14 Marzo 2024,"U.M.S.S. Casa a precio de lote, 420 m2, 2 dormitorios, dependencias, patio, jardín, garaje, $us. 297.000, Ofertable, 79788738",Cochabamba, Venta, Casa / Chalet
Temporal Casa Minimalista 2,Publicado: 14 Marzo 2024,"TEMPORAL Casa minimalista, 2 plantas, suite, 2 dormitorios, dependencias, patio, jardín, garaje, 79788738",Cochabamba, Venta, Casa / Chalet
Vendo Casa A Estrenar,Publicado: 14 Marzo 2024,"VENDO Casa a estrenar en condominio 1 suite, 2 dormitorios, garaje 2 autos, 150.000 $us. zona alto Aranjuez (templo mormón). 78350336.",Cochabamba, Venta, Casa / Chalet
Vendo Casa 3 Plantas,Publicado: 14 Marzo 2024,"VENDO casa 3 plantas, 2 suites, 2 dormitorios. Pasos Gabriel René moreno y américa. 370.000 $us. 78350336.",Cochabamba, Venta, Casa / Chalet
Vendo Casa A Estrenar,Publicado: 14 Marzo 2024,"VENDO casa a estrenar en condominio, 1 suite, 2 dormitorios. Mirador 235.000 $us. 78350336.",Cochabamba, Venta, Casa / Chalet
Vendo Casa 1 Suite,Publicado: 14 Marzo 2024,"VENDO casa 1 suite, 2 dormitorios. Garaje 2 movilidades. Av. Ecológica 2 cuadras antes del surtidor. 159.000 $us. 78350336.",Cochabamba, Venta, Casa / Chalet
Vendo Casa 3 Dormitorios,Publicado: 14 Marzo 2024,"VENDO casa 3 dormitorios, altillos. Departamento auxiliar. Zona Muyurina (pasos jardín botánico). 240.000 $us. 78350336.",Cochabamba, Venta, Casa / Chalet
Vendo Casa Dentro Urbanización,Publicado: 14 Marzo 2024,"VENDO Casa dentro Urbanización bella vista, 1 suite, 2 dormitorios, escritorio, sala de estar. Sacaba 4 ½ a una cuadra de la circunvalación. 143.000 $us. 78350336.",Cochabamba, Venta, Casa / Chalet
Vendo Casa Urb Lomas,Publicado: 14 Marzo 2024,"VENDO Casa Urb. Lomas de Aranjuez, 3 suites, 2 dormitorios, sala de cine, vista panorámica. 699.000 $us. 78350336.",Cochabamba, Venta, Casa / Chalet
Vendo Casa Planta Baja,Publicado: 14 Marzo 2024,"VENDO casa planta baja lote 288.59 m2, 1 suite, 2 dormitorios. Pasos Beijing y Simón López 230.000 $us. 78350336.",Cochabamba, Venta, Casa / Chalet
Vendo Casa 956 M2,Publicado: 14 Marzo 2024,"VENDO Casa 956 m2 lote frente 19.9m. Construcción planta baja 4 dormitorios. Zona temporal SEMAPA, a una cuadra de la circunvalación. 580.000 $us. 78350336.",Cochabamba, Venta, Casa / Chalet
Vendo Casa Planta Baja,Publicado: 14 Marzo 2024,"VENDO Casa planta baja, lote 847.64 m2. 4 suites, 5 baños, living comedor, cocina con comedor de diario, escritorio, sala de cine, amplio jardín. Zona Colegio Loyola, 680.000 $us. 78350336.",Cochabamba, Venta, Casa / Chalet
Vendo Casa Como Lote,Publicado: 14 Marzo 2024,VENDO casa como lote 505 m2 sobre Av. Rubén Darío (pasando puente Muyurina) 230.000 $us. 78350336.,Cochabamba, Venta, Casa / Chalet
Vendo Edificio 4 Plantas,Publicado: 14 Marzo 2024,"VENDO Edificio 4 plantas, lote 531 m2. Almacenes, oficinas, departamento 3 dormitorios. Frente al parque acuático, sobre Av. 390.000 $us. 78350336.",Cochabamba, Venta, Casa / Chalet
Lanza Chuquisaca Bonito Departamento,Publicado: 14 Marzo 2024,"LANZA, CHUQUISACA Bonito departamento, 167 m2, 3 dormitorios, dependencias, garaje, baulera, $us. 143.000, 79788738",Cochabamba, Venta, Departamento
Km 7 Blanco Galindo,Publicado: 14 Marzo 2024,"KM 7 BLANCO GALINDO Bonito departamento, 91 m2, 3 dormitorios, dependencias, garaje, piscina, áreas comunes, $us. 55.000, 79788738",Cochabamba, Venta, Departamento
Vendo Departamento 120 M2,Publicado: 14 Marzo 2024,"VENDO departamento 120 m2 piso 8, vista panorámica, 1 suite, 2 dormitorios, garaje, baulera. Melchor Urquidi y Portales (pasos Hupermall). 115.000 $us. 78350336.",Cochabamba, Venta, Departamento
Vendo Departamento 84 M2,Publicado: 14 Marzo 2024,"VENDO departamento 84 m2 1 suite, 1 dormitorio. Pando y Ciclovía. 77.000 $us. 78350336.",Cochabamba, Venta, Departamento
Vendo Departamento 95 M2,Publicado: 14 Marzo 2024,"VENDO departamento 95 m2 1 suite, 1 dormitorio, garaje, baulera, piscina. zona Puente Cobija 83.000 $us. 78350336.",Cochabamba, Venta, Departamento
Vendo Departamento 74 M2,Publicado: 14 Marzo 2024,"VENDO Departamento 74 m2, 1 suite, 1 dormitorio, parqueo, baulera. Beijing Tadeo Haenke. 69.000 $us. 78350336.",Cochabamba, Venta, Departamento
Vendo Departamento 122 M2,Publicado: 14 Marzo 2024,"VENDO departamento 122 m2, 1 suite, 2 dormitorios, garaje, baulera. América y Juan de la Rosa. 95.000 $us. 78350336.",Cochabamba, Venta, Departamento
Vendo Departamento Estrenar 2,Publicado: 14 Marzo 2024,"VENDO departamento estrenar 2 suites, garaje, piscina, sauna. Heroínas y Aurelio Melean. 110.000. $us. 78350336.",Cochabamba, Venta, Departamento
Vendo Departamento 161 M2,Publicado: 14 Marzo 2024,"VENDO departamento 161 m2 1 suite, 2 dormitorios, parqueo. América y Melchor Pérez. 115.000. $us. 78350336.",Cochabamba, Venta, Departamento
Vendo Departamento 179 M2,Publicado: 14 Marzo 2024,"VENDO departamento 179 m2, 1 suite, 2 dormitorios, 2 parqueos, Baulera. Melchor Urquidi, pasos boulevard. 190.000. $us. 78350336.",Cochabamba, Venta, Departamento
Vendo Departamento Planta Baja,Publicado: 14 Marzo 2024,"VENDO Departamento planta baja con patio privado 122 m2, 1 suite, 1 dormitorio, garaje, baulera. Juan de la rosa y Beijing 75.000 $us. 78350336.",Cochabamba, Venta, Departamento
Vendo Tienda U Oficina,Publicado: 14 Marzo 2024,"VENDO tienda u oficina 160 m2 plata baja salida a la calla, baño, cocineta sobre Av. Ayacucho casi Reza. 136.000 $us. 78350336.",Cochabamba, Venta, Local Comercial
Km 8 Avenida Circunvalacion,Publicado: 14 Marzo 2024,"KM 8 AVENIDA CIRCUNVALACION Lote amurallado, 280 m2, servicios en puerta, $us. 38.000,-, 79788738",Cochabamba, Venta, Lote / Terreno
Vendo Lote 307 23,Publicado: 14 Marzo 2024,"VENDO lote 307.23 m2, zona SEGIP 6 Km Blanco Galindo. 93.000. $us 78350336.",Cochabamba, Venta, Lote / Terreno
Las Cuadras Casa 3,Publicado: 14 Marzo 2024,"LAS CUADRAS Casa, 3 plantas, 4 dormitorios, dependencias, patio, jardín, garaje, Bs. 3.500, 79788738",Cochabamba, Alquiler, Casa / Chalet
Inmediaciones Prado Casa Para,Publicado: 14 Marzo 2024,"INMEDIACIONES PRADO Casa para Instituciones, 2 ambientes, 2 tiendas, baños, patio, garaje amplio, 79788738",Cochabamba, Alquiler, Casa / Chalet
Gimnasio Premier Garzonier Amoblado,Publicado: 14 Marzo 2024,"GIMNASIO PREMIER Garzonier amoblado, dormitorio, dependencias, Bs. 1.700, 79788738",Cochabamba, Alquiler, Departamento
Alquilo Departamento 3 Dormitorios,Publicado: 14 Marzo 2024,"ALQUILO departamento 3 dormitorios, baño, garaje. Villavicencio y Tunupa. 2000 Bs incluye expensas. 78350336.",Cochabamba, Alquiler, Departamento
Anticretico Casa 3 Plantas,Publicado: 14 Marzo 2024,"ANTICRETICO casa 3 plantas, 1 suite, 4 dormitorios, 5 baños, living comedor, cocina con comedor de diario. Precio 60.000 $us. zona Av. d’Orbigny 5 1/2 Km. 78350336.",Cochabamba, Anticrético, Casa / Chalet
Anticretico Departamento 1 Suite,Publicado: 14 Marzo 2024,"ANTICRETICO departamento 1 suite, 1 dormitorio, garaje. Tiquipaya Cond. Punta Cana. 19.000 $us. 78350336.",Cochabamba, Anticrético, Casa / Chalet
Vendo Dos Terrenos En,Publicado: 13 Marzo 2024,"VENDO Dos terrenos en urbanizaciòn exclusiva, Lomas de Aranjuez (616 m2). club house, vista incomparable. Ref. 72212874",Cochabamba, Venta, Lote / Terreno
Cerca A La Normal,Publicado: 13 Marzo 2024,"CERCA A LA NORMAL CATOLICA alquilo departamento, 3 dormitorios, 2 baños, cocina, living comedor. 70791140.",Cochabamba, Alquiler, Departamento
Propietario Alquila Elegante Departamento,Publicado: 13 Marzo 2024,"PROPIETARIO Alquila elegante departamento panorámico amoblado 200 m2, sobre el parque Fidel Anze, suite con baño, vestidor y balcón, 2 dormitorios, 3 baños, living/comedor, escritorio, cocina /comedor, servicios. Dos parqueos. Piscina atemperada, parrillero, salón. $us 900 incluidos expensas y agua...",Cochabamba, Alquiler, Departamento
Por Viaje Vendo Espacio,Publicado: 13 Marzo 2024,"POR VIAJE vendo espacio en Cementerio Concordia, sector Cedros, de 3 niveles, 25.000 $us, charlable. Ref. 70783382.",Cochabamba, Venta, Varios
Urgente Alquilo Departamento De,Publicado: 13 Marzo 2024,"URGENTE alquilo departamento, de 2 dormitorios, dependencias, Ladislao Cabrera oeste. Cel. 71418073.",Cochabamba, Alquiler, Departamento
900 Bs A Una,Publicado: 13 Marzo 2024,900 BS. A una cuadra Ecológica Aldeas SOS garzonier independiente alquiler 1 dormitorio dependencias gas domiciliario garaje moto entrega inmediata 77994624 Whatsapp,Cochabamba, Alquiler, Departamento
1 700 Bs Departamento,Publicado: 13 Marzo 2024,1.700 BS. Departamento independiente alquiler 3 dormitorios 2 baños dependencias completas lavandería garaje moto zona Mercado Cruce Taquiña 77994624 Whatsapp,Cochabamba, Alquiler, Departamento
Se Alquila Una Tienda,Publicado: 13 Marzo 2024,"SE ALQUILA una tienda comercial, sobre la Av. Tadeo Haenke, 900 Bs. y otra tienda, sobre la calle Atacama y Tadeo Haenke, 700 Bs. Nro de casa 2304. Cel. 79797285, fijo: 4067901.",Cochabamba, Alquiler, Local Comercial
1 300 Bs Tienda,Publicado: 13 Marzo 2024,1.300 BS. Tienda comercial alquiler ideal todo negocio de comida cuenta con cocina y baño privado Av. Blanco Galindo K m2 entrega inmediata 77994624 Whatsapp,Cochabamba, Alquiler, Local Comercial
20 000 $us Blanco,Publicado: 13 Marzo 2024,20.000 $US. Blanco Galindo Km. 2 anticrético casita bastante independiente 3 dormitorios 2 baños dependencias gas domiciliario garaje lavandería disponibilidad inmediata libre gravámenes 77994624 whatsapp,Cochabamba, Anticrético, Casa / Chalet
12 000 $us Anticrético,Publicado: 13 Marzo 2024,12.000 $US. Anticrético casita totalmente independiente planta baja Av. Ecológica Bateón a pasos Cruce Taquiña 1 dormitorio dependencias Gas domiciliario garaje moto libre gravámenes 77994624 Whatsapp,Cochabamba, Anticrético, Casa / Chalet
Departamento En Anticrético Frente,Publicado: 13 Marzo 2024,"DEPARTAMENTO en anticrético, frente a un colegio en la zona Sumumpaya, Km 8, Blanco Galindo. Ref. 73797256, 4378923.",Cochabamba, Anticrético, Departamento
6 000 $us Anticrético,Publicado: 13 Marzo 2024,6.000 $US. Anticrético cuarto amplio con baño ideal pareja garaje para moto libre de gravámenes entrega inmediata zona Cruce Taquiña 77994624 Whatsapp,Cochabamba, Anticrético, Habitación
Vendo Hermoso Departamento En,Publicado: 27 Marzo 2024,"VENDO hermoso departamento, en el 3er piso, del edificio ""La Fuente"", excelente oportunidad. Ref. 76161911, 72434684.",Cochabamba, Venta, Departamento
Lote En Venta Superficie,Publicado: 27 Marzo 2024,"LOTE en venta, superficie 814 m2, barrio Minero Alalay, calle 31 octubre Nro 100, Info: 62015551, 76018788 (propietarios).",Cochabamba, Venta, Lote / Terreno
En Venta Oficina Amplia,Publicado: 27 Marzo 2024,"EN VENTA oficina amplia, en plena Av. Ayacucho 59 m2, con baño privado, Edificio María Antonieta. Ref. 60347129.",Cochabamba, Venta, Oficina
Alquilo Casa Condominio Nuevo,Publicado: 27 Marzo 2024,"ALQUILO casa condominio nuevo, próximo peaje, Huayllani, 4 dormitorios, 2 garajes, dependencias, no mascotas. 71703501.",Cochabamba, Alquiler, Casa / Chalet
Alquiler Tienda Trastienda Zona,Publicado: 27 Marzo 2024,"ALQUILER Tienda trastienda zona “la cancha” hacia Av. Republica 1411, 71744650.",Cochabamba, Alquiler, Local Comercial
Anticretico Zona Las Cuadras,Publicado: 27 Marzo 2024,"ANTICRETICO (Zona: Las Cuadras) departamento 2 dormitorios. Nicaragua S-777 Telf. 4257662, Cel. 64895372.",Cochabamba, Anticrético, Departamento
Departamento Amplio 2 Dormitorios,Publicado: 27 Marzo 2024,"DEPARTAMENTO Amplio, 2 dormitorios, living comedor, cocineta, baño, garaje, $us 12.000 Avenida América Oeste Ref. 77421200",Cochabamba, Anticrético, Departamento
Urgente Alquilo Departamento De,Publicado: 27 Marzo 2024,"URGENTE alquilo departamento, de 2 dormitorios, dependencias, Ladislao Cabrera oeste. Cel. 71418073.",Cochabamba, Alquiler, Departamento
Alquilo Tienda Lanza N0350,Publicado: 27 Marzo 2024,"ALQUILO  tienda, Lanza N0350 entre Ecuador y Venezuela. Cel. 71406578.",Cochabamba, Alquiler, Local Comercial
Propeitario Vendo Terreno 646,Publicado: 27 Marzo 2024,"PROPEITARIO vendo terreno, 646 m2, El Paso - Quillacollo, documentación al día, 60.000 $us. Telf. 65511741.",Cochabamba, Venta, Lote / Terreno
Dueño Vende Lote En,Publicado: 27 Marzo 2024,"DUEñO vende lote en Quillacollo, 200 - 300 - 600 m2. Fono: 67519571.",Cochabamba, Venta, Lote / Terreno
Vendo Casas De 3,Publicado: 27 Marzo 2024,"VENDO casas de 3 y 4 dormitorios, en condominio, zona 4 Esquinas, Tiquipaya, casas, a estrenar, con financiamiento. 70767646, 69478128, 79788178.",Cochabamba, Venta, Casa / Chalet
En Venta Edificio Comercial,Publicado: 27 Marzo 2024,"EN VENTA edificio comercial, en la Av. República de 1010 m2 de terreno y 3015 m2, de construcción, precio 2.800.000 $us, conversable. Ref. 67453135.",Cochabamba, Venta, Edificios
Alquiler Departamento 2 Dormitorios,Publicado: 27 Marzo 2024,"ALQUILER Departamento 2 dormitorios, living comedor, cocina, baño. av. Simón López y Calampampa Ref. 76478115.",Cochabamba, Alquiler, Departamento
En Alquiler Consultorio Dental,Publicado: 27 Marzo 2024,"EN ALQUILER consultorio dental, equipado, Pacata baja. Cel. 79735978.",Cochabamba, Alquiler, Oficina
Departamento Anticrético Económico 3er,Publicado: 27 Marzo 2024,"DEPARTAMENTO anticrético, económico, 3er piso, amplio, c/roperos empotrados, 3 dormitorios, zona central. Telf. 76966609.",Cochabamba, Anticrético, Departamento
Alquiler De Oficinas Elegantes,Publicado: 27 Marzo 2024,"ALQUILER de oficinas elegantes, con baño privado y parqueo, precios rebajados, entre 23 a 42 m2, ideal para todo tipo de profesionales y consultoras. Ref. 25 de mayo 264 entre Sucre y Bolívar, edificio Franzur. Cel. 70798329.",Cochabamba, Alquiler, Oficina
Alquilo Departamento De Lujo,Publicado: 27 Marzo 2024,"ALQUILO  Departamento de lujo 3 dormitorios, edificio Victoria Avenida América y Santa Cruz. Teléfono 71778857",Cochabamba, Alquiler, Departamento
Vendo Casa Una Planta,Publicado: 26 Marzo 2024,"VENDO Casa una planta, 4 dormitorios, dependencias, jardín, 115.000 $us. Vìctor Ustariz zona IMBA. 72796276, 79344274.",Cochabamba, Venta, Casa / Chalet
Alquilo Departamento 4 Dormitorios,Publicado: 26 Marzo 2024,"ALQUILO Departamento, 4 dormitorios, 140 mts2. servicios, parqueo, seguridad, piscina atemperada. Condominio Horizonte. 73793483, 72745742",Cochabamba, Alquiler, Departamento
Alquilo Tienda Independiente 40,Publicado: 26 Marzo 2024,"ALQUILO Tienda independiente 40 mts2. 1/2 cuadra plazuela Cala Cala, cocineta, baño, servicios. 73793483, 72745742",Cochabamba, Alquiler, Local Comercial
Se Precisa Local Para,Publicado: 26 Marzo 2024,SE PRECISA Local para broasterìa en anticrètico. Tel. 72891321,Cochabamba, Alquiler, Demanda
Galpón En Venta Trópico,Publicado: 26 Marzo 2024,"GALPóN  En venta, Trópico Entre Ríos, de 1080 m2 documentación al día y planos aprobados para cine. 76980753",Cochabamba, Venta, Depósitos Galpones
Venta Hermosa Casa Inmediaciones,Publicado: 26 Marzo 2024,"VENTA hermosa casa, inmediaciones Cine Center, 530 m2, lote 380 m2 construcción. Cel./WP. 75900145, 77457710.",Cochabamba, Venta, Casa / Chalet
Vendo Departamento Condominio Horizonte,Publicado: 26 Marzo 2024,"VENDO Departamento “Condominio Horizonte”, 3 1/2 dormitorios, 3 baños, planta baja $us. 82.000. Cel. 72239000",Cochabamba, Venta, Departamento
Lote En Venta En,Publicado: 26 Marzo 2024,"LOTE en venta, en Colcapirhua, Piñami sud y venta de lote, para nicho, Esquilan Agrario. Ref. 72252618, 67426393.",Cochabamba, Venta, Lote / Terreno
Venta Oficinas Torres Del,Publicado: 26 Marzo 2024,"VENTA oficinas, Torres del Prado, con 2 parqueos, 4 bauleras, 150 m2. Cel./WP. 75900145, 77457710.",Cochabamba, Venta, Oficina
Venta Local Comercial Salida,Publicado: 26 Marzo 2024,"VENTA local comercial, salida a calle, c/Garaje, baño, cocineta, inmediaciones Stadium, WP. 75900145, 77457710.",Cochabamba, Venta, Local Comercial
1 700 Bs Temporal,Publicado: 26 Marzo 2024,1.700 BS. Temporal Cala Cala alquiler departamento 2 dormitorios dependencias completas garaje opcional entrega inmediata 77994624 Whatsapp,Cochabamba, Alquiler, Departamento
1 700 Bs Cruce,Publicado: 26 Marzo 2024,1.700 BS. Cruce Taquiña mercado alquiler amplio departamento bastante iluminado 3 dormitorios 1 en suite todas con cortinas 2 baños dependencias completas lavandería garaje opcional entrega inmediata 77994624 Whatsapp,Cochabamba, Alquiler, Departamento
Alquilo Habitación Servicios Wifi,Publicado: 26 Marzo 2024,"ALQUILO Habitación servicios wifi semiamoblado, pasando puente cobija 700 cocina baño compartido WhatsApp: 70723836.",Cochabamba, Alquiler, Habitación
12 000 $us Independiente,Publicado: 26 Marzo 2024,"12,000 $US, independiente anticrético departamento planta baja 2 dormitorios amplios dependencias gas domiciliario lavandería garaje libre de gravámenes entrega inmediata Circunvalación Oeste 77994624 Whatsapp",Cochabamba, Anticrético, Departamento
Familia Busca Casa En,Publicado: 24 Marzo 2024,Familia busca CASA EN ANTICRETICO. En zona norte u oeste de Cochabamba. WhatsApp 62645925,Cochabamba, Anticrético, Demanda
Departamento En Venta Edificio,Publicado: 24 Marzo 2024,"DEPARTAMENTO En venta Edificio Ovando. Celular 77486775, 4244333 Ecuador y Ayacucho",Cochabamba, Venta, Departamento
3 Oficinas En Alquiler,Publicado: 24 Marzo 2024,3 OFICINAS En alquiler zona central llamar 77486775 1º piso,Cochabamba, Alquiler, Oficina
Departamento En Anticrético Ladislao,Publicado: 24 Marzo 2024,"DEPARTAMENTO En anticrético Ladislao cabrera y Ayacucho WhatsApp 72262996, 77486775",Cochabamba, Anticrético, Departamento
Vendo Hermosa Casa A,Publicado: 24 Marzo 2024,"VENDO hermosa casa a estrenar, 1 suite, 2 dormitorios y demás dependencias, zona Alto Aranjuez, cerca Templo Mormón. Telf. 72201235.",Cochabamba, Venta, Casa / Chalet
Casa A Estrenar Inmediaciones,Publicado: 24 Marzo 2024,"CASA A estrenar inmediaciones Hospital del Norte 2da Circunvalación, cuatro dormitorios, dos en suite y demás dependencias completas amplias $us 170.000. 72203818",Cochabamba, Venta, Casa / Chalet
Vendo Casa En Buenas,Publicado: 24 Marzo 2024,"VENDO casa en buenas condiciones, habitable, Villa Litoral, calle Cobija, camarones y terrenos agrícolas en Parotani - Tajra. 77480990, 76474702.",Cochabamba, Venta, Casa / Chalet
Av 6 De Agosto,Publicado: 24 Marzo 2024,"AV. 6 DE AGOSTO alquiler o anticrético, amplio departamento, con terraza, primer piso, familia reducida. 78325321.",Cochabamba, Alquiler, Departamento
Propietario Alquila Departamento Av,Publicado: 24 Marzo 2024,"PROPIETARIO alquila departamento, Av. Heroínas, 2 dormitorios, living, cocina, baño, garaje, 4500111, 60735555, abstenerse inmobiliarias.",Cochabamba, Alquiler, Departamento
