titulo,fecha,descripcion,departamento,tipo,inmueble
Parque Fidel Anze Alquiler,Publicado: 24 Marzo 2024,PARQUE FIDEL ANZE ALQUILER Departamentos de Lujo 3 y 2 Dormitorios Con y Sin Muebles. Informaciones 70313588 fotos www.alquileres.vendohogar.net,Cochabamba, Alquiler, Departamento
Icnorte America Departamento Amoblado,Publicado: 24 Marzo 2024,"ICNORTE AMERICA Departamento Amoblado de Lujo 175m2 3: Dormitorios, Garaje, Hermosa Vista, 70313588 fotos www:alquileres:vendohogar:net",Cochabamba, Alquiler, Departamento
Parque Fidel Anze $us400,Publicado: 24 Marzo 2024,"PARQUE FIDEL ANZE $US400 En Alquiler Hermoso Departamento 150 m2, 3 Dormitorios, Dependencias, Garaje, informaciones 70313588 vendohogar",Cochabamba, Alquiler, Departamento
Amoblado Ejecutivo Lindo Departamento,Publicado: 24 Marzo 2024,"AMOBLADO EJECUTIVO Lindo Departamento Suite, 2 dormitorios, área servicio, garaje, 700 $us América Este 77404700",Cochabamba, Alquiler, Departamento
De Ocasion Se Alquila,Publicado: 24 Marzo 2024,"DE OCASION se alquila oficina, 115 m2, cuenta con 1 baño y una cocineta, Torre Colombo. Ref. 71776641.",Cochabamba, Alquiler, Oficina
Cerca Av Oquendo Oficina,Publicado: 24 Marzo 2024,"CERCA AV. OQUENDO Oficina 30 m2 baño privado, garaje, expensas, 250 $us zona empresarial, salud 77404700",Cochabamba, Alquiler, Oficina
Amplia Tienda En Alquiler,Publicado: 24 Marzo 2024,"AMPLIA TIENDA en alquiler, plena esquina, Jordán, Abaroa, frente Unitel, 100 m2, 4 puertas, blindex, 2 baños. 70779123, abstenerse inmobiliarias.",Cochabamba, Alquiler, Local Comercial
Alquiler Local Comercial 10x3,Publicado: 24 Marzo 2024,"ALQUILER Local comercial 10x3 mts2. con baño privado, calle Beni Nº 236 Ref. 69443403",Cochabamba, Alquiler, Local Comercial
Tiendas En Alquiler Frente,Publicado: 24 Marzo 2024,"TIENDAS en alquiler, frente al parque urbano, Ollantay y en la Av. General Campero. Ref. 4446393, 72702593.",Cochabamba, Alquiler, Local Comercial
Tienda En Alquiler Calle,Publicado: 24 Marzo 2024,TIENDA En alquiler calle España entre Colombia y Ecuador. 36 mts. 72294592,Cochabamba, Alquiler, Local Comercial
Restaurant Cafeteria En Alquiler,Publicado: 24 Marzo 2024,"RESTAURANT CAFETERIA en alquiler calle España entre Colombia y ecuador, con cocina, 4.000 Bs. 72294592",Cochabamba, Alquiler, Local Comercial
Alquilo Tienda Céntrica Paccieri,Publicado: 24 Marzo 2024,ALQUILO Tienda céntrica. Paccieri esquina Antezana. Whatsapp 65510897,Cochabamba, Alquiler, Local Comercial
Cuartos En Alquiler Todo,Publicado: 24 Marzo 2024,"CUARTOS en alquiler, todo incluido, agua, luz, UV CB, internet, con garaje o sin garaje. Cel. 69627219.",Cochabamba, Alquiler, Habitación
Alquilo Habitación Cocina Baño,Publicado: 24 Marzo 2024,"ALQUILO habitación, cocina, baño privado, Circunvalación, Potosí, Violetas. 71705836, 4591672.",Cochabamba, Alquiler, Habitación
Alquiler Dos Cuartos Con,Publicado: 24 Marzo 2024,"ALQUILER Dos cuartos con cocina y baño, Villa Granado. 79974409",Cochabamba, Alquiler, Habitación
Cuarto Amplio Alquiler Baño,Publicado: 24 Marzo 2024,"CUARTO Amplio alquiler, baño compartido, zona ELFEC, calle Suipacha entre Santiváñez y Jordàn. 77427944",Cochabamba, Alquiler, Habitación
Alquilo Habitación Zona Prado,Publicado: 24 Marzo 2024,ALQUILO Habitación zona Prado y mercado 10 de Febrero. 4404006,Cochabamba, Alquiler, Habitación
Se Alquila Habitación Amplia,Publicado: 24 Marzo 2024,SE ALQUILA Habitación amplia con WiFi a señorita estudiante cerca al Parque Excombatientes. Cel. 72262547,Cochabamba, Alquiler, Habitación
Alquilo Tinglado Oficinas Vivienda,Publicado: 24 Marzo 2024,"ALQUILO Tinglado, oficinas, vivienda, apto para empresas, avenida Amèrica casi Beijing. 76933276",Cochabamba, Alquiler, Depósitos Galpones
Galpon Industrial En Alquiler,Publicado: 24 Marzo 2024,"GALPON INDUSTRIAL en alquiler, zona Arocagua, superficie techada, 1904 m2, área oficinas, 246 m2, 2 ingresos, para camiones, de alto tonelaje. Cel. 60374124.",Cochabamba, Alquiler, Depósitos Galpones
Anticretico Casa Independiente 4,Publicado: 24 Marzo 2024,"ANTICRETICO casa independiente, 4 dormitorios, sala, comedor, cocina, baño, 12.000 $us, Villazón, Km 7 Sacaba. 61628222.",Cochabamba, Anticrético, Casa / Chalet
Anticretico Casa Independiente Amplia,Publicado: 24 Marzo 2024,"ANTICRETICO casa independiente, amplia, 3 dormitorios, sala, comedor, cocina, baño, garaje, gas, jardín, 20.000 $us o Bs. 140.000 Bs. Av. Chapare, Km 3 Sacaba. 61628222.",Cochabamba, Anticrético, Casa / Chalet
Anticretico Casa Independiente 3,Publicado: 24 Marzo 2024,"ANTICRETICO casa independiente, 3 plantas amplia, 3 dormitorios, roperos, sala, comedor, cocina, cajonería, jardín, garaje, 32.000 $us, Segip. 61628222.",Cochabamba, Anticrético, Casa / Chalet
Anticretico Chalet De 2,Publicado: 24 Marzo 2024,"ANTICRETICO chalet de 2 pisos, trato directo con el dueño, valor 26 mil dólares. Cel. 63327666, whatsapp +5511989281076, en Tiquipaya, Villa Satelite, Av. Cristo de la Concordia esquina Kantuta, 4 dormitorios, amplio living comedor, cocina, con gas natural, domiciliario, 2 baños, con ducha, calefón...",Cochabamba, Anticrético, Casa / Chalet
Hermoso Departamento 177 M2,Publicado: 24 Marzo 2024,HERMOSO Departamento 177 m2 Cala Cala 1 suite 2 dormitorios dependencias Terraza propia piscina sauna jacuzzi 2 garajes 55.000 $us. 72275744,Cochabamba, Anticrético, Departamento
Bonito Departamento Cerca Surtidor,Publicado: 24 Marzo 2024,BONITO Departamento cerca Surtidor Petrogas Chimba 1 suite 2 dormitorios dependencias 2 garajes parrillero 25.000 $us. 72275744,Cochabamba, Anticrético, Departamento
$us 15 000 17,Publicado: 24 Marzo 2024,"$US. 15.000, 17.000 Anticréticos departamentos a estrenar zona central Sacaba 2 a 3 dormitorios 75913011.",Cochabamba, Anticrético, Departamento
$us 18 000 30,Publicado: 24 Marzo 2024,"$US 18.000, 30.000  Anticréticos departamentos céntricos 2,3 dormitorios próximo UMSS 75913011.",Cochabamba, Anticrético, Departamento
Departamento Anticrético De 4,Publicado: 24 Marzo 2024,"DEPARTAMENTO anticrético, de 4 habitaciones, con dependencias, zona base Aérea, Av. Cabildo. Ref. 75498516, 78310953.",Cochabamba, Anticrético, Departamento
Doy Departamento Anticrético 21,Publicado: 24 Marzo 2024,"DOY DEPARTAMENTO anticrético, 21.500 $us, 5to piso, edificio Marenas, Av. d'Orbigny, frente surtidor Laureles, parqueo y baulera, 2 dormitorios, cocina, living comedor, cocina, baño. Cel. 862-2476313.",Cochabamba, Anticrético, Departamento
Departamento En Anticrético 32,Publicado: 24 Marzo 2024,DEPARTAMENTO En anticrético 32.000 $us rotonda Perú Costa de 1 suite con baño privado 2 dormitorios living comedor cocina baño y estudio. Cel. 64909391,Cochabamba, Anticrético, Departamento
Anticretico Ofertable 12 000,Publicado: 24 Marzo 2024,ANTICRETICO Ofertable 12.000 $us. departamento América-Taborga 60358213.,Cochabamba, Anticrético, Departamento
Anticreticos Departamentos Amplios 170,Publicado: 24 Marzo 2024,"ANTICRETICOS departamentos amplios, 170 m2. 3 dormitorios, escritorio, dependencias, garaje, 30.000 $us. zona surtidor Automòvil Club, 72796276, 79344274",Cochabamba, Anticrético, Departamento
Anticretico Departamento 3 Dormitorios,Publicado: 24 Marzo 2024,"ANTICRETICO Departamento, 3 dormitorios, Chimba, 72751914.",Cochabamba, Anticrético, Departamento
Bonito Departamento 130 M2,Publicado: 24 Marzo 2024,"BONITO departamento, 130 m2, Av. Pando, 3 cuadras, parque Fidel Anze, 3 dormitorios, dependencias, garaje, anticrético, $us 33.000, registrable, Derechos Reales. Ref. 72720474.",Cochabamba, Anticrético, Departamento
Anticretico Departamento En Anticrético,Publicado: 24 Marzo 2024,"ANTICRETICO departamento en anticrético, de 60 m2, Tiquipaya, Villa Satelite, Av. Cristo de la Concordia, esquina Kantuta, whatsapp. +5511989281076, 75 mil Bolivianos, Cel. 63327666, amplia suite, con baño, ducha, con calefón, cocina con gas natural domiciliario, living comedor y demás dependencias...",Cochabamba, Anticrético, Departamento
12 000 $us Independiente,Publicado: 24 Marzo 2024,12.000 $US. Independiente anticrético departamento planta baja 2 dormitorios amplios dependencias Gas domiciliario lavandería garaje libre de gravámenes entrega inmediata Circunvalación Oeste 77994624 Whatsapp,Cochabamba, Anticrético, Departamento
Hermoso Garzonier En Anticrético,Publicado: 24 Marzo 2024,"HERMOSO garzonier, en anticrético, 17.000 $us, a una cuadra de la plazuela de Cala Cala, sobre la calle Adela Zamudio. Telf. 73041088, 72211616.",Cochabamba, Anticrético, Departamento
Amplio Departamento Céntrico 1,Publicado: 24 Marzo 2024,"AMPLIO DEPARTAMENTO céntrico, 1 suite, 2 dormitorios, roperos empotrados, 3 baños completos, área de lavado, dependencias empleada, avenida Oquendo y Bolivia, $us 25.000, referencias: 77421200.",Cochabamba, Anticrético, Departamento
Maestro Departamento Amplio 2,Publicado: 24 Marzo 2024,"MAESTRO departamento amplio, 2 dormitorios, living comedor, baño, cocineta, avenida América y Melchor Perez, $us 10.000. Ref. 77421200.",Cochabamba, Anticrético, Departamento
Anticretico Zona Las Cuadras,Publicado: 24 Marzo 2024,"ANTICRETICO (Zona Las Cuadras) departamento 2 dormitorios. Nicaragua S-777 Telf. 4257662, Cel. 64895372.",Cochabamba, Anticrético, Departamento
Ocasion América Oeste Anticrético,Publicado: 24 Marzo 2024,"OCASION América oeste anticrético departamento 2 dormitorios, primer piso independiente, directamente propietario. Sra. Elena 70385109",Cochabamba, Anticrético, Departamento
Garzonier Anticrético 6to Piso,Publicado: 24 Marzo 2024,"GARZONIER anticrético, 6to piso, terraza, s/ascensor, no hay garaje, $us 16.000, zona central, Ecuador, Hamiraya, entrega inmediata. 74377783.",Cochabamba, Anticrético, Departamento
Anticretico Cuarto Con Baño,Publicado: 24 Marzo 2024,"ANTICRETICO cuarto con baño privado, a estudiante en Pq. La Torre. Ref. 60343074.",Cochabamba, Anticrético, Habitación
Anticretico Amplia Habitación Sanitarios,Publicado: 24 Marzo 2024,"ANTICRETICO Amplia habitación, sanitarios compartidos dólares 2.800 charlable, Melchor Pérez entrega inmediata 69499547.",Cochabamba, Anticrético, Habitación
Anticretico Amplia Habitación Baño,Publicado: 24 Marzo 2024,"ANTICRETICO Amplia habitación, baño privado, parqueo motos, dólares 4.300 charlable Melchor Pérez entrega inmediata 77452985.",Cochabamba, Anticrético, Habitación
Melchor Perez Simon Lopez,Publicado: 24 Marzo 2024,"MELCHOR PEREZ, SIMON LOPEZ Casa, 2 plantas, 3 dormitorios, dependencias, tienda, patio, garaje, $us. 118.000. Ofertable, 79788738",Cochabamba, Venta, Casa / Chalet
Pacata Baja Bonita Casa,Publicado: 24 Marzo 2024,"PACATA BAJA Bonita casa, 2 departamentos, dependencias, patio, jardín, garaje, $us 130.000. Ofertable, 79788738",Cochabamba, Venta, Casa / Chalet
Junin Calama Casa Comercial,Publicado: 24 Marzo 2024,"JUNIN, CALAMA Casa Comercial, 272 m2, 5 tiendas, baños, cocina, $us. 240.000. 79788738",Cochabamba, Venta, Casa / Chalet
Avenida Villazon Km 5,Publicado: 24 Marzo 2024,"AVENIDA VILLAZON KM. 5 Bonita casa, 2 plantas, suite, 3 dormitorios, escritorio, dependencias, patio, jardín, parrillero, garaje, $us. 120.000. Ofertable, 79788738",Cochabamba, Venta, Casa / Chalet
Tadeo Haenke Beijing Casa,Publicado: 24 Marzo 2024,"TADEO HAENKE, BEIJING Casa, 2 plantas, 3 dormitorios, dependencias, patio, jardín, garaje, $us. 165.000. Ofertable, 79788738",Cochabamba, Venta, Casa / Chalet
Final America Oeste Bonita,Publicado: 24 Marzo 2024,"FINAL AMERICA OESTE Bonita casa, 3 niveles, master suite, suite, 3 dormitorios, escritorio, dependencias, dependencias de servicio, patio, jardín, parrillero, garaje. 79788738",Cochabamba, Venta, Casa / Chalet
Villa Moscu Bonita Casa,Publicado: 24 Marzo 2024,"VILLA MOSCu Bonita casa, 2 plantas, 2 suites, 3 dormitorios, escritorio, dependencias, bar, sauna, dependencias de servicio, horno, semi sótano, patio, jardín, parrillero, garaje, $us 180.000. Ofertable, 79788738",Cochabamba, Venta, Casa / Chalet
Urbanizacion El Vergel 1,Publicado: 24 Marzo 2024,URBANIZACION EL VERGEL 1 suite 3 dormitorios demás dependencias garaje para 2 movilidades 118.000 $us 79792959,Cochabamba, Venta, Casa / Chalet
Cala Cala Inmediaciones Huallparimachi,Publicado: 24 Marzo 2024,CALA CALA inmediaciones Huallparimachi antigua super iluminada con amplios jardines sobre 549 m2 de terreno 467.000 $us 79792959,Cochabamba, Venta, Casa / Chalet
Beni Inmediaciones Recoleta Súper,Publicado: 24 Marzo 2024,BENI inmediaciones Recoleta súper comercial antigua como lote sobre 495 m2 de terreno 9.50 de frente 360.000 $us 70343434,Cochabamba, Venta, Casa / Chalet
Condominio Cerrado Chiquicollo Sobre,Publicado: 24 Marzo 2024,CONDOMINIO CERRADO Chiquicollo sobre 335 m2 de terreno 270 m2 construidos 2 suites 2 dormitorios amplio jardín 265.000 $us 70343434,Cochabamba, Venta, Casa / Chalet
Recoleta Inmediaciones Aniceto Padilla,Publicado: 24 Marzo 2024,RECOLETA Inmediaciones Aniceto Padilla casa antigua Sobre 450 m2 de terreno 350 m2 construidos 5 dormitorios demás dependencias 470.000 $us 70343434,Cochabamba, Venta, Casa / Chalet
San Pedro Casa Antigua,Publicado: 24 Marzo 2024,SAN PEDRO casa antigua con medias aguas sobre 350 m2 de terreno 235.000 $us 70343434,Cochabamba, Venta, Casa / Chalet
Pacata Inmediaciones Calvert Frente,Publicado: 24 Marzo 2024,PACATA inmediaciones Calvert frente a parque casa antigua sobre 550 m2 terreno 185.000 $us 79792959,Cochabamba, Venta, Casa / Chalet
Beijing Tadeo Haenke Inmediaciones,Publicado: 24 Marzo 2024,"BEIJING, TADEO HAENKE inmediaciones $us. 259.000 casa amplia, frente de 19x25 480 m2, 4 dormitorios, jardín, 65752958",Cochabamba, Venta, Casa / Chalet
$us 92 000 Tiquipaya,Publicado: 24 Marzo 2024,"$us. 92.000, Tiquipaya-Apote casas en condominio, piscina, 3 y 4 dormitorios, 65752958",Cochabamba, Venta, Casa / Chalet
$us 139 000 Casa,Publicado: 24 Marzo 2024,"$us. 139.000 Casa independiente, Chilimarca y Circunvalación, 270 m2, 4 dormitorios, amplio jardín, 69419654",Cochabamba, Venta, Casa / Chalet
Simon Lopez Mercado 10,Publicado: 24 Marzo 2024,"SIMON LOPEZ Mercado 10 Febrero inmediaciones, estrene casa, $us. 179.000, 4 ambientes, 3 plantas, 60388770",Cochabamba, Venta, Casa / Chalet
$us 129 000 Casas,Publicado: 24 Marzo 2024,"$us. 129.000 Casas en venta independientes, 3 dormitorios, km 3 Av. Villazón, 65752958",Cochabamba, Venta, Casa / Chalet
CircunvalaciÓn Linde Casas De,Publicado: 24 Marzo 2024,"CIRCUNVALACIÓN-LINDE, casas de lujo en condominio, $us. 135.000, 4 dormitorios, 65752958",Cochabamba, Venta, Casa / Chalet
$us 120 000 Casas,Publicado: 24 Marzo 2024,"$us. 120.000 Casas en Preventa, 3 suites, en Condominio, Trojes-Tiquipaya, 65752958",Cochabamba, Venta, Casa / Chalet
Alto Aranjuez Casas De,Publicado: 24 Marzo 2024,"ALTO ARANJUEZ Casas de lujo, 220 m2, $us. 200.000 4 dormitorios, en condominio, 65752958",Cochabamba, Venta, Casa / Chalet
$us 119 000 Casa,Publicado: 24 Marzo 2024,"$us. 119.000, Casa en Condominio, 3 dormitorios, Final Villavicencio-Complejo el Carmen, 65752958",Cochabamba, Venta, Casa / Chalet
$us 149 000 Casas,Publicado: 24 Marzo 2024,"$us. 149.000 Casas en preventa, Tadeo Hanke y Av. Sexta, 220 m2, 4 dormitorios, 65752958",Cochabamba, Venta, Casa / Chalet
Templo Mormon Alto Aranjuez,Publicado: 24 Marzo 2024,"TEMPLO MORMON-Alto Aranjuez casas en condominio $us. 145.000, 3 dormitorios, cocina equipada 60388770",Cochabamba, Venta, Casa / Chalet
Mansion En Venta Tadeo,Publicado: 24 Marzo 2024,"MANSION en venta, Tadeo Haenke y Villavicencio, 1226 m2, 5 dormitorios, $us. 780.000, piscina, sauna, jardines, 65752958",Cochabamba, Venta, Casa / Chalet
$us 149 000 Hermosas,Publicado: 24 Marzo 2024,"$us. 149.000, Hermosas casas en Condominio, Sirpita-Villavicencio, 3 suites piscina, 200 m2, 69419654",Cochabamba, Venta, Casa / Chalet
Lanza Chuquisaca Bonito Departamento,Publicado: 24 Marzo 2024,"LANZA, CHUQUISACA Bonito departamento, 167 m2, 3 dormitorios, dependencias, garaje, baulera, $us. 143.000. 79788738",Cochabamba, Venta, Departamento
Km 7 Blanco Galindo,Publicado: 24 Marzo 2024,"KM 7 BLANCO GALINDO Bonito departamento, 91 m2, 3 dormitorios, dependencias, garaje, piscina, áreas comunes, $us. 58.000. 79788738",Cochabamba, Venta, Departamento
America Inmediaciones Libertador 95,Publicado: 24 Marzo 2024,AMERICA Inmediaciones Libertador 95 m2 1 suite 2 dormitorios linda vista garaje 82.900 $us 70343434,Cochabamba, Venta, Departamento
America Inmediaciones Primer Puente,Publicado: 24 Marzo 2024,AMERICA inmediaciones primer puente sobre 120 m2 a estrenar 1 suite 2 dormitorios mas garaje 109.000 $us 79792959,Cochabamba, Venta, Departamento
America Inmediaciones Beijing Sobre,Publicado: 24 Marzo 2024,AMERICA inmediaciones Beijing sobre 105 m2 1 suite 1 dormitorios escritorio garaje y baulera 89.000 $us 79792959,Cochabamba, Venta, Departamento
El Castillo Inmediaciones Sobre,Publicado: 24 Marzo 2024,EL CASTILLO inmediaciones sobre 120 m2 en condominio con canchas y piscina amplias áreas comunes 1 suite 2 dormitorios más garaje 78.000 $us 70343434,Cochabamba, Venta, Departamento
Fidel Anze Penthouse Araucaria,Publicado: 24 Marzo 2024,FIDEL ANZE Penthouse (Araucaria) dúplex sobre 350 m2 1 suite 2 dormitorios parrillero terraza estar demás dependencias 2 garajes baulera 380.000 $ 79792959,Cochabamba, Venta, Departamento
Man Cesped Prácticamente Nuevo,Publicado: 24 Marzo 2024,MAN CESPED prácticamente nuevo con linda vista sobre 85 m2 1 suite 1 dormitorio garaje baulera 87.000 $us 79792959,Cochabamba, Venta, Departamento
Av America Inmediaciones Av,Publicado: 24 Marzo 2024,AV. AMERICA Inmediaciones Av. Gabriel Rene Moreno 146.68 m2 3 dormitorios escritorio área de servicio 2 garaje 100.000 $us 70343434,Cochabamba, Venta, Departamento
Av Libertador Inmediaciones Plazuela,Publicado: 24 Marzo 2024,AV. LIBERTADOR Inmediaciones plazuela de Cala Cala 1 suite 2 dormitorios sobre 145 m2 mas terraza de 20 m2 super iluminado 112.000 $us 79792959,Cochabamba, Venta, Departamento
Av Villarroel Inmediaciones Unifranz,Publicado: 24 Marzo 2024,AV. VILLARROEL Inmediaciones UNIFRANZ 88 m2 1 suite 1 dormitorio más garaje 74.000 $us 79792959,Cochabamba, Venta, Departamento
Av America Inmediaciones Premier,Publicado: 24 Marzo 2024,AV. AMERICA Inmediaciones Premier sobre 118 m2 2 dormitorios baño cocina área de máquinas living comedor más garaje y baulera 105.000 $us 79792959,Cochabamba, Venta, Departamento
Ciclovia Inmediaciones Instituto Americano,Publicado: 24 Marzo 2024,CICLOVIA inmediaciones Instituto Americano a estrenar de lujo sobre 104 m2 1 suite 1 dormitorio garaje y baulera 147.000 $us 79792959,Cochabamba, Venta, Departamento
Cala Cala 1 Suite,Publicado: 24 Marzo 2024,CALA CALA 1 suite 1 dormitorio de lujo entrega en mayo sobre 112 m2 piso alto hermosa vista mas garaje y baulera 158.000 $us 70343434,Cochabamba, Venta, Departamento
Juan De La Rosa,Publicado: 24 Marzo 2024,JUAN DE LA ROSA Y AMERICA precioso 154 m2 1 suite 2 dormitorios mas garaje semi amoblado piscina 145.900 $us 79792959,Cochabamba, Venta, Departamento
Recoleta Estrene Departamento $us,Publicado: 24 Marzo 2024,"RECOLETA estrene departamento, $us. 83.520, 2 dormitorios, escritorio, 87 m2, 72221219",Cochabamba, Venta, Departamento
$us 89 000 Departamento,Publicado: 24 Marzo 2024,"$us. 89.000, departamento , 144 m2, Pando y 2da circunvalación, 3 dormitorios, 69419654",Cochabamba, Venta, Departamento
Parque Lincoln $us 119,Publicado: 24 Marzo 2024,"PARQUE LINCOLN, $us. 119.000, 3 dormitorios, 115 m2, garaje, departamento en venta, 65752958",Cochabamba, Venta, Departamento
$us 164 000 Eudoro,Publicado: 24 Marzo 2024,"$us. 164.000 Eudoro Galindo, América, departamento 3 dormitorios, garaje y baulera, 166 m2, 65752958",Cochabamba, Venta, Departamento
Villarroel Y America Departamento,Publicado: 24 Marzo 2024,"VILLARROEL Y AMERICA, departamento, 103 m2, 2 dormitorios, escritorio, $us. 95.000, garaje y baulera, 65752958",Cochabamba, Venta, Departamento
Duplex De Lujo En,Publicado: 24 Marzo 2024,"DUPLEX de lujo en venta, Cala Cala, 2 dormitorios, 105.000 $, 95 m2, 65752958",Cochabamba, Venta, Departamento
Cala Cala Penthouse En,Publicado: 24 Marzo 2024,"CALA CALA, Penthouse en venta, $us. 147.000, 180 m2, parqueo y baulera, 3 dormitorios, 65752958",Cochabamba, Venta, Departamento
Av Santa Cruz Inmediaciones,Publicado: 24 Marzo 2024,"AV. SANTA CRUZ inmediaciones sobre 86 m2 4 ambientes mas recepción, cocineta, 2 baños 77.000 $us 70343434",Cochabamba, Venta, Oficina
Zona Central Sobre 75,Publicado: 24 Marzo 2024,ZONA CENTRAL sobre 75 m2 49.900 $us y otra de 128 m2 89.000 $us ambas a 1 cuadra de la plaza principal. Se aceptan bolivianos o permuta de auto o terreno 79792959,Cochabamba, Venta, Oficina
Zona Central 105 M2,Publicado: 24 Marzo 2024,ZONA CENTRAL 105 m2 con 2 cocinetas y dos baños 79.000 $us y otra de 57.20 m2 a 44.000 $us 70343434,Cochabamba, Venta, Oficina
Km 6 Avenida Villazon,Publicado: 24 Marzo 2024,"KM 6 AVENIDA VILLAZON Lote, 204 m2, servicios en puerta, $us. 30.000,-, 79788738",Cochabamba, Venta, Lote / Terreno
Bosque Norte Sobre 1,Publicado: 24 Marzo 2024,BOSQUE NORTE sobre 1.000 m2 parte central 280.000 $us 70343434,Cochabamba, Venta, Lote / Terreno
Carretera A Sacaba Km,Publicado: 24 Marzo 2024,CARRETERA A SACABA Km. 7 ½ a 2 cuadras de la carretera al sud 969 m2 140.000 $us 79792959,Cochabamba, Venta, Lote / Terreno
Tiquipaya 8 000 M2,Publicado: 24 Marzo 2024,TIQUIPAYA 8.000 m2 a una cuadra de Av. Cochabamba antes de llegar al Hotel Regina 115 $us x m2 70343434,Cochabamba, Venta, Lote / Terreno
Trojes A Pasos De,Publicado: 24 Marzo 2024,TROJES A pasos de la Av. Circunvalación 4.800 m2 ideal para condominios 190 $us x m2 70343434,Cochabamba, Venta, Lote / Terreno
Km 7 Av Villazon,Publicado: 24 Marzo 2024,"KM 7 AV. VILLAZON-INMEDIACIONES Lote sobre Av. De 20m, 54.000 $, esquina frente 24x13, 350 m2, servicios, 65752958",Cochabamba, Venta, Lote / Terreno
America Oeste Av Segunda,Publicado: 24 Marzo 2024,"AMERICA OESTE Av.Segunda, lote 275 m2, 16 frente, $us. 119.000, servicios, 65752958",Cochabamba, Venta, Lote / Terreno
Sobre Avenida Guadalquivir Pacata,Publicado: 24 Marzo 2024,"SOBRE AVENIDA GUADALQUIVIR Pacata baja, casa como lote, 500 m2, $us. 169.000, 12 frente, servicios, 65752958",Cochabamba, Venta, Lote / Terreno
$us 85 000 Lote,Publicado: 24 Marzo 2024,"$us. 85.000, lote en venta 400 m2, Circunvalación este km 7, servicios, 23x17 frente, 65752958",Cochabamba, Venta, Lote / Terreno
Av Sexta Final Villavicencio,Publicado: 24 Marzo 2024,"AV. SEXTA Final Villavicencio, 205 m2, lote $us. 47.000, 10 frente, servicios, 65752958",Cochabamba, Venta, Lote / Terreno
D Orbigyi Km 7,Publicado: 24 Marzo 2024,"d’ORBIGYI KM 7 Casa, 3 dormitorios, cocina, baño, jardín, garaje, Bs. 1.500. 79788738",Cochabamba, Alquiler, Casa / Chalet
Inmediaciones Prado Departamento Totalmente,Publicado: 24 Marzo 2024,"INMEDIACIONES PRADO Departamento totalmente amoblado, 3 dormitorios, dependencias, Bs. 3.000. 79788738",Cochabamba, Alquiler, Departamento
El Castillo Inmediaciones 1,Publicado: 24 Marzo 2024,EL CASTILLO inmediaciones 1 suite 2 dormitorios amplias áreas comunes piscina más garaje 1800 bs 70343434,Cochabamba, Alquiler, Departamento
Av Villavicencio Cerca A,Publicado: 24 Marzo 2024,AV VILLAVICENCIO cerca a condominio Magnolias 3 dormitorios demás dependencias garaje para 2 movilidades incluye expensas 2000 bs 70343434,Cochabamba, Alquiler, Departamento
Fidel Anze 135 M2,Publicado: 24 Marzo 2024,"FIDEL ANZE 135 m2 1 suite 2 dormitorios demás dependencias vista al parque 450 $us 70343434,",Cochabamba, Alquiler, Departamento
Cala Cala Inmediaciones Plazuela,Publicado: 24 Marzo 2024,CALA CALA inmediaciones plazuela precioso 1 suite 1 dormitorio garaje baulera 420 $us con expensas incluidas 70343434,Cochabamba, Alquiler, Departamento
Fidel Anze 104 M2,Publicado: 24 Marzo 2024,"FIDEL ANZE 104 m2 1 suite 1 dormitorios demás dependencias completamente amoblado 500 $us 70343434,",Cochabamba, Alquiler, Departamento
Beni Inmediaciones Recoleta Planta,Publicado: 24 Marzo 2024,BENI inmediaciones recoleta planta baja con salida a la calle sobre 120 m2 aproximadamente para cualquier tipo de emprendimiento 800 $us 70343434,Cochabamba, Alquiler, Local Comercial
Tiquipaya Condominio Cerrado Inmediaciones,Publicado: 24 Marzo 2024,TIQUIPAYA Condominio cerrado inmediaciones colegio Tiquipaya con piscina 2 suites 2 dormitorios 300 m2 de construcción demás dependencias garaje para 2 movilidades 70.000 $us 79792959,Cochabamba, Anticrético, Casa / Chalet
58 000 $us Vendo,Publicado: 28 Marzo 2024,"58.000 $US vendo casita, Jordán, Tarapaca, trato propietaria, papeles al día. 67598690.",Cochabamba, Venta, Casa / Chalet
Lote En Venta Zona,Publicado: 28 Marzo 2024,"LOTE en venta, zona Huayllani en plena Av. Circunvalación, a 2 cuadras del puente asfaltado, papeles e impuestos al día, 337.50 m2, $us 65.000, contacto: 63859294, whatsapp o llamada.",Cochabamba, Venta, Lote / Terreno
Terreno En Venta En,Publicado: 28 Marzo 2024,"TERRENO En venta en Itocta 400 m2 amurallado, interesados llamar: 75909148.",Cochabamba, Venta, Lote / Terreno
DueÑa De Casa Alquila,Publicado: 28 Marzo 2024,"DUEÑA De casa, alquila o vende casa y departamento, pacata baja 75756827.",Cochabamba, Alquiler, Casa / Chalet
Departamento En Alquiler Zona,Publicado: 28 Marzo 2024,"DEPARTAMENTO En alquiler zona norte 3 habitaciones y dependencias, Telf. 75981558.",Cochabamba, Alquiler, Departamento
Alquiler Departamentos Garzonier Cerca,Publicado: 28 Marzo 2024,"ALQUILER departamentos, garzonier, cerca Medicina, UMSS, EMI, Católica. 2 formas. 72209500.",Cochabamba, Alquiler, Departamento
Tienda En Alquiler Calle,Publicado: 28 Marzo 2024,"TIENDA En alquiler, calle Colombia entre Oquendo y 16 de Julio 79950055.",Cochabamba, Alquiler, Local Comercial
